{
  "contract_version": "atlas.cortex.receipt-interpretation.v1",
  "generated_at": "2026-05-12T13:56:25.362433+00:00",
  "authority_level": "read_only_interpretation",
  "stack_root": "C:/ATLAS/tmp/r18-main-merge-20260511",
  "interpretation_id": "receipt-interpretation-promote-cortex-receipt-interpretation-consumption-feedback-wave11",
  "next_recommended_lane": {
    "lane_id": "promote-cortex-receipt-interpretation-consumption-feedback-wave11",
    "owner_layer": "cortex",
    "rationale": "Cortex now emits receipt interpretation and proves _stack can consume it through explicit artifact refs. The next bounded contract is read-only feedback over that consumption: summarize what changed, what proved, and what remains blocked as deterministic next-lane guidance without dispatching work, executing work, approving work, issuing final receipts, mutating owner or Lifeline truth, or scraping transcripts."
  },
  "authority": {
    "interpretation_authorized": true,
    "final_receipt_authorized": false,
    "approval_authorized": false,
    "execution_authorized": false,
    "dispatch_authorized": false,
    "owner_truth_mutation_authorized": false,
    "lifeline_truth_mutation_authorized": false,
    "transcript_scraping_allowed": false
  },
  "artifact_inputs": [
    {
      "role": "worker_prompt",
      "ref": "runtime/cortex/worker-prompts/latest.json",
      "contract_version": "atlas.cortex.worker-prompt.v1",
      "digest": "sha256:2baa8a633dc4aa2b1a9086acc2b401c78872371478cb87588e49b2d4be81a179"
    },
    {
      "role": "stack_advisory_handoff",
      "ref": "runtime/cortex/stack-advisory-handoff/latest.json",
      "contract_version": "atlas.cortex.stack-advisory-handoff.v2",
      "digest": "sha256:266db2646b751963d090f29c0933f6bdcd96257075e90e8033f12509f9cac21e"
    },
    {
      "role": "stack_consumption_pilot",
      "ref": "runtime/cortex/stack-consumption-pilot/latest.json",
      "contract_version": "atlas.cortex.stack-consumption-pilot.v1",
      "digest": "sha256:da375ec929e69af828eba44defb363732704f72742174beb6f0a975612735e78"
    },
    {
      "role": "ledger",
      "ref": "runtime/cortex/ledger/latest.json",
      "contract_version": "atlas.cortex.ledger.v1",
      "digest": "sha256:f80bf57b49c70e6e5e1c6ec60c54b2e6cd509c33abb8b29f348cd16208feffb0"
    },
    {
      "role": "validation_receipt",
      "ref": "runtime/receipts/validation/stack-validation.latest.json",
      "contract_version": "",
      "digest": "sha256:8dff0bbe12c4cbe7f266e19586617ba5d57ae2111b10fc4dfac1e03750b78e5c"
    },
    {
      "role": "state_model_seed",
      "ref": "runtime/cortex/kernel.state-model.seed.v1.json",
      "contract_version": "atlas.cortex.kernel-state.v1",
      "digest": "sha256:e5b5541cc6aad444c94243f15bcc9a62324f429ecc2420fa1528a0ba61f3c4a8"
    },
    {
      "role": "rule_registry_seed",
      "ref": "runtime/cortex/kernel.rule-registry.seed.v1.json",
      "contract_version": "atlas.cortex.rule-registry.v1",
      "digest": "sha256:2fd682949c691e054aa160fd15bf6205a9f661d41022f22ef83e39c27b08ac54"
    }
  ],
  "receipt_observations": [],
  "interpreted_proof_summary": {
    "status": "proof_ready",
    "what_changed": [
      "Cortex selected lane promote-cortex-receipt-interpretation-consumption-feedback-wave11 for read-only receipt interpretation.",
      "Receipt interpretation joins worker prompt, stack handoff, stack pilot, ledger, validation, seed, and rule artifacts."
    ],
    "what_proved": [
      "Stack advisory handoff is ready.",
      "Stack-consumption pilot is ready.",
      "Validation has no critical or error findings."
    ],
    "what_remains_blocked": [
      "No final Lifeline receipt artifact observed; Cortex interpretation remains advisory."
    ],
    "receipt_authority_summary": "Lifeline owns final receipt authority; Cortex interpretation is advisory only."
  },
  "interpretation_checks": [
    {
      "check_id": "validation-critical-error-absent",
      "status": "passed",
      "summary": "Stack validation has no critical or error findings.",
      "source_ref": "runtime/receipts/validation/stack-validation.latest.json"
    },
    {
      "check_id": "stack-advisory-handoff-ready",
      "status": "passed",
      "summary": "Canonical stack advisory handoff is ready.",
      "source_ref": "runtime/cortex/stack-advisory-handoff/latest.json"
    },
    {
      "check_id": "stack-advisory-handoff-authority-guard-clean",
      "status": "passed",
      "summary": "Stack advisory handoff does not widen dispatch, execution, receipt, owner-truth, or transcript authority.",
      "source_ref": "runtime/cortex/stack-advisory-handoff/latest.json"
    },
    {
      "check_id": "stack-consumption-pilot-ready",
      "status": "passed",
      "summary": "Stack-consumption pilot is ready.",
      "source_ref": "runtime/cortex/stack-consumption-pilot/latest.json"
    },
    {
      "check_id": "stack-consumption-pilot-authority-guard-clean",
      "status": "passed",
      "summary": "Stack-consumption pilot does not widen execution, receipt, owner-truth, routing, or transcript authority.",
      "source_ref": "runtime/cortex/stack-consumption-pilot/latest.json"
    },
    {
      "check_id": "cortex-final-receipt-authority-absent",
      "status": "passed",
      "summary": "Consumed receipt-like artifacts do not claim Cortex as final receipt owner.",
      "source_ref": null
    }
  ],
  "interpretation_result": {
    "status": "ready",
    "ready_for_stack_consumer": true,
    "blocked_reason": null,
    "failed_checks": []
  },
  "authority_guards": [
    "Cortex receipt interpretation is a read-only proof-summary surface.",
    "Lifeline remains the final receipt authority.",
    "Receipt interpretation does not approve work, execute work, dispatch _stack work, or mutate owner truth.",
    "Receipt interpretation consumes explicit artifacts only and does not scrape transcripts."
  ],
  "boundary_reminders": [
    "Cortex may interpret explicit receipt artifacts and summarize proof posture only.",
    "Lifeline owns final receipt authority.",
    "_stack owns orchestration and dispatch truth.",
    "Cortex must not issue final receipts, approve work, mutate owner truth, or scrape transcripts.",
    "Cortex observes, interprets, and proves.",
    "Cortex does not become owner truth for product, governance, or receipts.",
    "Fitness owns product UI truth.",
    "_stack owns orchestration and enforcement truth.",
    "Lifeline owns receipt and approval truth."
  ],
  "source_refs": [
    "runtime/cortex/worker-prompts/latest.json",
    "runtime/cortex/stack-advisory-handoff/latest.json",
    "runtime/cortex/stack-consumption-pilot/latest.json",
    "runtime/cortex/ledger/latest.json",
    "runtime/receipts/validation/stack-validation.latest.json",
    "runtime/cortex/kernel.state-model.seed.v1.json",
    "runtime/cortex/kernel.rule-registry.seed.v1.json"
  ]
}
